{
  "$schema": "./runtime-required-contract.schema.json",
  "version": 1,
  "generatedBy": "phase-de-runtime-required-audit",
  "doctrine": {
    "meaning": "This is NOT a schema authority. It is the checked-in statement of which canonical PHYSICAL fields current REQUIRED_NOW behaviour actually requires. Entries are derived from the completed runtime-authority audit (registry.json) and grounded in canonical-43 runtime consumption. Stale ORM declarations are NEVER treated as canonical requirements — those live in runtime-drift-dispositions.json.",
    "source": "apps/union-eyes/db/schema-authority/registry.json + reports/union-eyes/inventory/UE_WAVE1_RUNTIME_MATRIX.md (43-row canonical acceptance unit)",
    "usageVocabulary": ["DIRECTLY_CONSUMED", "AUTHORITY_SEMANTIC", "WRITE_REQUIRED", "FILTER_REQUIRED", "JOIN_REQUIRED", "ORDER_REQUIRED"],
    "accessVocabulary": ["READ", "WRITE"],
    "acceptanceIdScheme": "W1-R{n} references row n of the 43-row wave-1 runtime matrix; W1-UNIVERSAL-AUTH is the org-context auth path that gates every one of the 43 rows."
  },
  "entries": [
    {
      "schema": "public",
      "table": "organizations",
      "column": "id",
      "owner": "DJANGO_CANONICAL",
      "requirement": "REQUIRED_NOW",
      "usage": "DIRECTLY_CONSUMED",
      "access": "READ",
      "wave1_acceptance_ids": ["W1-UNIVERSAL-AUTH"],
      "source_paths": ["apps/union-eyes/lib/organization-utils.ts"],
      "reason": "Organization context resolves org.id for every canonical-43 experience; app_id consumers are rewritten to org.id (see registry organizations STALE_DRIZZLE_DECLARATION)."
    },
    {
      "schema": "public",
      "table": "organization_members",
      "column": "deleted_at",
      "owner": "DJANGO_CANONICAL",
      "requirement": "REQUIRED_NOW",
      "usage": "AUTHORITY_SEMANTIC",
      "access": "READ",
      "wave1_acceptance_ids": ["W1-UNIVERSAL-AUTH"],
      "source_paths": ["apps/union-eyes/lib/organization-utils.ts"],
      "reason": "getOrganizationIdForUser filters isNull(organizationMembers.deletedAt) on the universal org-context auth path (7 sites). Missing physically -> 42703 breaks EVERY dashboard."
    },
    {
      "schema": "public",
      "table": "organization_members",
      "column": "name",
      "owner": "DJANGO_CANONICAL",
      "requirement": "REQUIRED_NOW",
      "usage": "DIRECTLY_CONSUMED",
      "access": "READ",
      "wave1_acceptance_ids": ["W1-R11", "W1-R36"],
      "source_paths": ["apps/union-eyes/app/api/organization/members/route.ts"],
      "reason": "Member-directory route rows.map() directly consumes m.name for staff /dashboard/members and admin /dashboard/admin/members."
    },
    {
      "schema": "public",
      "table": "organization_members",
      "column": "email",
      "owner": "DJANGO_CANONICAL",
      "requirement": "REQUIRED_NOW",
      "usage": "DIRECTLY_CONSUMED",
      "access": "READ",
      "wave1_acceptance_ids": ["W1-R11", "W1-R36"],
      "source_paths": ["apps/union-eyes/app/api/organization/members/route.ts"],
      "reason": "Member-directory route rows.map() directly consumes m.email."
    },
    {
      "schema": "public",
      "table": "organization_members",
      "column": "phone",
      "owner": "DJANGO_CANONICAL",
      "requirement": "REQUIRED_NOW",
      "usage": "DIRECTLY_CONSUMED",
      "access": "READ",
      "wave1_acceptance_ids": ["W1-R11", "W1-R36"],
      "source_paths": ["apps/union-eyes/app/api/organization/members/route.ts"],
      "reason": "Member-directory route rows.map() directly consumes m.phone."
    },
    {
      "schema": "public",
      "table": "organization_members",
      "column": "department",
      "owner": "DJANGO_CANONICAL",
      "requirement": "REQUIRED_NOW",
      "usage": "DIRECTLY_CONSUMED",
      "access": "READ",
      "wave1_acceptance_ids": ["W1-R11", "W1-R36"],
      "source_paths": ["apps/union-eyes/app/api/organization/members/route.ts"],
      "reason": "Member-directory route rows.map() directly consumes m.department."
    },
    {
      "schema": "public",
      "table": "organization_members",
      "column": "location",
      "owner": "DJANGO_CANONICAL",
      "requirement": "REQUIRED_NOW",
      "usage": "DIRECTLY_CONSUMED",
      "access": "READ",
      "wave1_acceptance_ids": ["W1-R11", "W1-R36"],
      "source_paths": ["apps/union-eyes/app/api/organization/members/route.ts"],
      "reason": "Member-directory route rows.map() directly consumes m.location."
    },
    {
      "schema": "public",
      "table": "organization_members",
      "column": "position",
      "owner": "DJANGO_CANONICAL",
      "requirement": "REQUIRED_NOW",
      "usage": "DIRECTLY_CONSUMED",
      "access": "READ",
      "wave1_acceptance_ids": ["W1-R11", "W1-R36"],
      "source_paths": ["apps/union-eyes/app/api/organization/members/route.ts"],
      "reason": "Member-directory route rows.map() directly consumes m.position."
    },
    {
      "schema": "public",
      "table": "organization_members",
      "column": "hire_date",
      "owner": "DJANGO_CANONICAL",
      "requirement": "REQUIRED_NOW",
      "usage": "DIRECTLY_CONSUMED",
      "access": "READ",
      "wave1_acceptance_ids": ["W1-R11", "W1-R36"],
      "source_paths": ["apps/union-eyes/app/api/organization/members/route.ts"],
      "reason": "Member-directory route rows.map() directly consumes m.hireDate (hire_date)."
    },
    {
      "schema": "public",
      "table": "organization_members",
      "column": "seniority",
      "owner": "DJANGO_CANONICAL",
      "requirement": "REQUIRED_NOW",
      "usage": "DIRECTLY_CONSUMED",
      "access": "READ",
      "wave1_acceptance_ids": ["W1-R11", "W1-R36"],
      "source_paths": ["apps/union-eyes/app/api/organization/members/route.ts"],
      "reason": "Member-directory route rows.map() directly consumes m.seniority."
    },
    {
      "schema": "public",
      "table": "organization_members",
      "column": "union_join_date",
      "owner": "DJANGO_CANONICAL",
      "requirement": "REQUIRED_NOW",
      "usage": "DIRECTLY_CONSUMED",
      "access": "READ",
      "wave1_acceptance_ids": ["W1-R11", "W1-R36"],
      "source_paths": ["apps/union-eyes/app/api/organization/members/route.ts"],
      "reason": "Member-directory route rows.map() directly consumes m.unionJoinDate (union_join_date)."
    },
    {
      "schema": "public",
      "table": "organization_members",
      "column": "metadata",
      "owner": "DJANGO_CANONICAL",
      "requirement": "REQUIRED_NOW",
      "usage": "DIRECTLY_CONSUMED",
      "access": "READ",
      "wave1_acceptance_ids": ["W1-R11", "W1-R36"],
      "source_paths": ["apps/union-eyes/app/api/organization/members/route.ts"],
      "reason": "Member-directory route rows.map() directly consumes m.metadata."
    },
    {
      "schema": "public",
      "table": "organization_members",
      "column": "joined_at",
      "owner": "DJANGO_CANONICAL",
      "requirement": "REQUIRED_NOW",
      "usage": "DIRECTLY_CONSUMED",
      "access": "READ",
      "wave1_acceptance_ids": ["W1-R11", "W1-R36"],
      "source_paths": ["apps/union-eyes/app/api/organization/members/route.ts"],
      "reason": "Member-directory route rows.map() consumes membership joined_at as the roster join timestamp."
    },
    {
      "schema": "public",
      "table": "claims",
      "column": "idempotency_hash",
      "owner": "DJANGO_CANONICAL",
      "requirement": "REQUIRED_NOW",
      "usage": "WRITE_REQUIRED",
      "access": "WRITE",
      "wave1_acceptance_ids": ["W1-R3"],
      "source_paths": ["apps/union-eyes/app/api/cases/intake/route.ts", "apps/union-eyes/app/api/cases/bulk-import/route.ts"],
      "reason": "idempotency_hash backs the write+dedup guard (eq(claims.idempotencyHash, ...) + insert) in /api/cases/intake and bulk-import, reached by canonical-43 row 3 (/dashboard/claims/new)."
    },
    {
      "schema": "public",
      "table": "documents",
      "column": "title",
      "owner": "DJANGO_CANONICAL",
      "requirement": "REQUIRED_NOW",
      "usage": "DIRECTLY_CONSUMED",
      "access": "READ",
      "wave1_acceptance_ids": ["W1-R4", "W1-R12"],
      "source_paths": ["apps/union-eyes/lib/services/document-service.ts"],
      "reason": "document-service full-shape db.query.documents.findFirst returns the whole document row to member (row 4) and staff (row 12) /dashboard/documents."
    },
    {
      "schema": "public",
      "table": "documents",
      "column": "filename",
      "owner": "DJANGO_CANONICAL",
      "requirement": "REQUIRED_NOW",
      "usage": "DIRECTLY_CONSUMED",
      "access": "READ",
      "wave1_acceptance_ids": ["W1-R4", "W1-R12"],
      "source_paths": ["apps/union-eyes/lib/services/document-service.ts"],
      "reason": "document-service full-shape read materialises documents.filename for member/staff /dashboard/documents."
    },
    {
      "schema": "public",
      "table": "documents",
      "column": "name",
      "owner": "DJANGO_CANONICAL",
      "requirement": "REQUIRED_NOW",
      "usage": "DIRECTLY_CONSUMED",
      "access": "READ",
      "wave1_acceptance_ids": ["W1-R4", "W1-R12"],
      "source_paths": ["apps/union-eyes/lib/services/document-service.ts"],
      "reason": "document-service full-shape read materialises documents.name."
    },
    {
      "schema": "public",
      "table": "documents",
      "column": "file_url",
      "owner": "DJANGO_CANONICAL",
      "requirement": "REQUIRED_NOW",
      "usage": "DIRECTLY_CONSUMED",
      "access": "READ",
      "wave1_acceptance_ids": ["W1-R4", "W1-R12"],
      "source_paths": ["apps/union-eyes/lib/services/document-service.ts"],
      "reason": "document-service full-shape read materialises documents.file_url."
    },
    {
      "schema": "public",
      "table": "documents",
      "column": "file_type",
      "owner": "DJANGO_CANONICAL",
      "requirement": "REQUIRED_NOW",
      "usage": "DIRECTLY_CONSUMED",
      "access": "READ",